idAmazon,idGoogleBase,title,Googlename,class
b00006jo4g,http://www.google.com/base/feeds/snippets/17983103067016649420,punch! super home suite,punch software 38100 punch! super home suite (small box),matching
b00006jo4g,http://www.google.com/base/feeds/snippets/10206096308013781162,punch! super home suite,punch software 38100 punch! super home suite (small box),matching
b00006jo4g,http://www.google.com/base/feeds/snippets/15933205235519328818,punch! super home suite,punch software punch! super home suite,matching
b00006jo4g,http://www.google.com/base/feeds/snippets/17694493073700371269,punch! super home suite,punch software 38100 punch! super home suite (small box),matching
b000v7y5j4,http://www.google.com/base/feeds/snippets/17269511268099992892,quickverse bible premier suite,individual software inc quickverse bible premier suite (us pos),matching
b000f7bps4,http://www.google.com/base/feeds/snippets/12516109834871224117,palo alto marketing plan pro 9.0,palo alto software mpd9 - palo alto marketing plan v.9.0 pro - complete product - business planning - 1 user - complete product - standard - pc,matching
b000gkxmea,http://www.google.com/base/feeds/snippets/17230198637846961402,easy video editor 2.0 by honest technology,global marketing partners easy video editor 2.0 - honest technology,matching
b000gwfgqk,http://www.google.com/base/feeds/snippets/13692542638505368471,palo alto business plan pro premier 2007,palo alto software bpdx - palo alto business plan 2007 pro premier edition - complete product - business planning - 1 user - complete product - standard - pc,matching
b00006h3dw,http://www.google.com/base/feeds/snippets/17252201200051627446,national parks: enhanced scenery add-on for microsoft flight simulator 2002 & 2000,abacus national parks enhanced scenery,matching
b000gkshi6,http://www.google.com/base/feeds/snippets/16952776452110398384,palo alto business plan pro 2007,palo alto software business plan pro 2007,matching
b000gkshi6,http://www.google.com/base/feeds/snippets/8354689508970608357,palo alto business plan pro 2007,palo alto software bppx - palo alto business plan 2007 pro - complete product - business planning - 1 user - complete product - standard - pc,matching
b000oftj8u,http://www.google.com/base/feeds/snippets/4224056639442959853,adobe after effects cs3,adobe cs3 after effects,matching
b000oftj8u,http://www.google.com/base/feeds/snippets/13461495034626913881,adobe after effects cs3,adobe after effects cs3 professional software for mac effects software,matching
b000bd1ad2,http://www.google.com/base/feeds/snippets/17267430885978125860,namo webeditor 2006,csdc namo webeditor suite 2006,matching
b00007g3ai,http://www.google.com/base/feeds/snippets/10901373095934236651,punch! master landscape & home design,punch software 25100 punch! master landscape and home design,matching
b00007g3ai,http://www.google.com/base/feeds/snippets/15756558104583624199,punch! master landscape & home design,punch software 25100 - punch! master landscape & home design - architectural - 1 user(s) - pc,matching
b00007g3ai,http://www.google.com/base/feeds/snippets/11265957088683077055,punch! master landscape & home design,punch software 25100 punch! master landscape and home design,matching
b00007g3ai,http://www.google.com/base/feeds/snippets/2519306436830554150,punch! master landscape & home design,punch software 25100 punch! master landscape and home design,matching
b0001mbatc,http://www.google.com/base/feeds/snippets/17075992384109050018,black & white platinum pack (mac),feral interactive limited black & white platinum pack,matching
b0009hj5ve,http://www.google.com/base/feeds/snippets/904752907591542149,webroot desktop firewall,webroot software inc 54210 - webroot desktop firewall - firewall - pc,matching
b0009hj5ve,http://www.google.com/base/feeds/snippets/5100323510083618710,webroot desktop firewall,webroot software 54210 desktop firewall,matching
b0009hj5ve,http://www.google.com/base/feeds/snippets/4036053921422681767,webroot desktop firewall,webroot software 54210 desktop firewall,matching
b0009hj5ve,http://www.google.com/base/feeds/snippets/17031778429388398652,webroot desktop firewall,webroot software 54210 desktop firewall,matching
b000063v0z,http://www.google.com/base/feeds/snippets/3325089562849958903,punch! 5 in 1 home design,punch software 24100 - punch! 5 in 1 home design - complete product - architectural - 1 user - complete productcomplete productstandard - pc,matching
b000o39qyo,http://www.google.com/base/feeds/snippets/17273913360738156669,city of heroes good vs. evil edition,nc interactive inc city of heroes: good vs. evil edition,matching
b000k757w4,http://www.google.com/base/feeds/snippets/17265475148454123541,business card factory deluxe 3.0,nova development corp business card factory deluxe 3.0,matching
b000e65hki,http://www.google.com/base/feeds/snippets/11050991040966629398,punch! home design architectural series 4000 v10,punch software 84100 - punch! home design architectural series 4000 v.10.0 - architectural - pc,matching
b000p4v8am,http://www.google.com/base/feeds/snippets/17411076438303340250,big tiny little a tiny little christmas,big tiny little big tiny little - a tiny little christmas,matching
b000v809mk,http://www.google.com/base/feeds/snippets/17424435152951418977,systemsuite 8 professional,individual software inc systemsuite 8 professional (us pos),matching
b000v7vz2e,http://www.google.com/base/feeds/snippets/17926987006913487270,jumpstart 4th-6th grade v 2.0 b43,knowledge adventure inc. jumpstart 4th-6th grade v 2.0 b43,matching
b000hlt55i,http://www.google.com/base/feeds/snippets/17411408037622367354,pcdefense,avanquest usa llc pcdefense,matching
b0009yn1ks,http://www.google.com/base/feeds/snippets/17450858518393943272,starry night astronomy screensaver win/mac,orion/imaginova starry night screensaver,matching
b000fabege,http://www.google.com/base/feeds/snippets/17453864721509833307,quickverse sermon builder 4.0,findex.com inc sermon builder 4.0,matching
b000ezmxcy,http://www.google.com/base/feeds/snippets/17440820469218114890,ultra sudoku/ultra kakuro,abacus ultra sudoku/ultra kakuro,matching
b00008wiww,http://www.google.com/base/feeds/snippets/2096220602293961985,snap! spelling (jewel case),spelling,matching
b000skvy20,http://www.google.com/base/feeds/snippets/11359745283620291559,acad vegas movie studio +dvd 8 platinum,madison media software aspvms8000 - acad vegas movie studio +dvd 8 platinum,matching
b000j1h08k,http://www.google.com/base/feeds/snippets/17943324820292919047,bitdefender antivirus 10.0 [2 year subscription for 2 pcs],global marketing partners antivirus v.10 - bit defender,matching
b000hhvb5e,http://www.google.com/base/feeds/snippets/2651646167662758246,scrabble with bonus clue,encore software 11610 - scrabble with bonus clue - win 98 me 2000 xp,matching
b000hi1i2e,http://www.google.com/base/feeds/snippets/2084347887571442067,scrabble complete (jewel case),encore software 11290 - scrabble complete - win 98 me xp,matching
b000b6jasg,http://www.google.com/base/feeds/snippets/17471276055285923188,piano wizard premier software & stickers & midi cable,re:launch piano wizard premier software & stickers & midi cable,matching
b000gamysk,http://www.google.com/base/feeds/snippets/17641037628832356751,emedia guitarpro 5 win/mac,emedia music corp guitar pro v 5.1 (hybrid),matching
b000jx3mx0,http://www.google.com/base/feeds/snippets/18142071205016449884,spycatcher 2007for pc,avanquest usa llc spycatcher 2007,matching
b000twz14o,http://www.google.com/base/feeds/snippets/17467141222535233488,intuit quicken home inventory manager - windows,intuit inc quicken home inventory manager,matching
b000lozewy,http://www.google.com/base/feeds/snippets/17477502346334387395,academy award winners,bobby walters academy award winners,matching
b000i7zabo,http://www.google.com/base/feeds/snippets/17479437813216357894,ca antivirus 2007,ca antivirus 2007,matching
b000hkpfje,http://www.google.com/base/feeds/snippets/17501757616782483517,zonealarm pro firewall,zone labs zonealarm pro,matching
b00004t2un,http://www.google.com/base/feeds/snippets/17501987182659378619,sales skills 2.0 ages 10+,simply magazine sales skills,matching
b000v7riie,http://www.google.com/base/feeds/snippets/17523098183862840727,brain builder,sos aggregation company brain builder - core learning,matching
b00005v55b,http://www.google.com/base/feeds/snippets/18011756922272923721,return to castle wolfenstein (mac),aspyr media inc return to castle wolfenstein,matching
b00005v55b,http://www.google.com/base/feeds/snippets/12732181672723754930,return to castle wolfenstein (mac),aspyr return to castle wolfenstein,matching
b00065hjvc,http://www.google.com/base/feeds/snippets/17535862274044952617,solitaire antics deluxe,masque publishing solitaire antics deluxe,matching
b000nkpf7k,http://www.google.com/base/feeds/snippets/17506547254238780201,aircraft collector's second edition,abacus aircraft collectors second edition,matching
b000jx5rz6,http://www.google.com/base/feeds/snippets/17634318125830822917,findex quickverse bible study 2007 bible-suite,findex.com inc quickverse bible study 2007 bible suite,matching
b000ndo7n0,http://www.google.com/base/feeds/snippets/17544063525352738794,video patrol 5.0 by honest technology,global marketing partners video patrol 5.0 - honest technology,matching
b000gcgqvy,http://www.google.com/base/feeds/snippets/17456162504360585884,snap! kakuro,topics entertainment snap! kakuro,matching
1931102953,http://www.google.com/base/feeds/snippets/12729065138733783657,instant immersion american sign language win/mac,american sign language,matching
b0000yebre,http://www.google.com/base/feeds/snippets/4921806606938865897,simple slide show,simple slide show,matching
b000egidpy,http://www.google.com/base/feeds/snippets/5558998293398547766,printmaster platinum v 17.0,print master platinum v17,matching
b000gpsz42,http://www.google.com/base/feeds/snippets/17546591632033422235,street atlas usa 2007 plus dvd,delorme mapping street atlas usa 2007 plus dvd xx,matching
b000i84dum,http://www.google.com/base/feeds/snippets/17544872940647061920,jumpstart world 2nd grade,knowledge adventure inc. jumpstart world 2nd grade - mini box,matching
b000hus51e,http://www.google.com/base/feeds/snippets/17827472274973329884,great invasions,strategy first inc. great invasions,matching
b000bb7fjw,http://www.google.com/base/feeds/snippets/17614065814468597783,web graphics creator,sos aggregation company web graphics creator - laughingbird software,matching
b000bgtvbc,http://www.google.com/base/feeds/snippets/15661314377252665074,instant immersion translator deluxe 2.0,instant immersion translator deluxe 2.0,matching
b000v7vz1u,http://www.google.com/base/feeds/snippets/17615743519264436737,onone essentials for adobe photoshop elements version 2 - full,onone software essentials for adobe photoshop elements version 2 - full,matching
b0007m69s8,http://www.google.com/base/feeds/snippets/17998064550570873069,funny faces deluxe,fogware publishing funny faces,matching
b000051sgq,http://www.google.com/base/feeds/snippets/17588771746186862436,emedia blues guitar legends,emedia music corp emedia blues guitar legends,matching
b000rhdusa,http://www.google.com/base/feeds/snippets/17582660229215283000,age of empires iii: the warchiefs expansion pack (mac),destineer inc age of empires iii: the warchiefs expansion pack,matching
b000rhdusa,http://www.google.com/base/feeds/snippets/11927579066669830952,age of empires iii: the warchiefs expansion pack (mac),age of empires iii: warchiefs expansion pack,matching
b000jx5shs,http://www.google.com/base/feeds/snippets/17578507241939502542,guitar tool - worship edition,midisoft corporation guitar tool - worship edition,matching
b000ezmxz6,http://www.google.com/base/feeds/snippets/18127050167172376780,delorme topo usa mapping software 6.0 east region,delorme mapping topo usa 6.0 east region,matching
b000v9yxj4,http://www.google.com/base/feeds/snippets/17521446718236049500,nero 8 ultra edition,nero inc nero 8 ultra edition,matching
b000pienka,http://www.google.com/base/feeds/snippets/17520994730465780544,weekly reader mastering high school 2008,fogware publishing weekly reader ls mastering high school 2008,matching
b000fb9w3a,http://www.google.com/base/feeds/snippets/17941162981056466173,northstar for pc/mac,true north technology inc. northstar,matching
b000szyqam,http://www.google.com/base/feeds/snippets/18111145490199629534,make music allegro 2007 labpack - 5 user,hal leonard allegro 2007 5-user labpack,matching
b000jx84va,http://www.google.com/base/feeds/snippets/17836395815164917371,instant immersion hawaiian audio,topics entertainment instant immersion hawaiian audio,matching
b000nkklwy,http://www.google.com/base/feeds/snippets/18277858650749573891,power translator 11 premium,csdc power translator 11 premium - language engineering company,matching
b000in6tnq,http://www.google.com/base/feeds/snippets/18251424810598585817,liquid ledger personal finance,csdc liquid ledger personal finance - modeless software,matching
b000iflerk,http://www.google.com/base/feeds/snippets/17776155287333548087,sportsman's double play,masque publishing sportsmans double play,matching
b000exu99k,http://www.google.com/base/feeds/snippets/17647670175814866187,jumpstart advanced preschool v2.0,knowledge adventure inc. jumpstart advanced preschool v2.0,matching
b000kmaa8a,http://www.google.com/base/feeds/snippets/17648688592984612014,visual thesaurus the - thinkmap inc.,csdc visual thesaurus the - thinkmap inc.,matching
b000lptgc2,http://www.google.com/base/feeds/snippets/17624778694912125664,phonics success essentials: grades 7-9,topics entertainment phonics success essentials,matching
b00005auzh,http://www.google.com/base/feeds/snippets/17640225934406949646,cook'n cd recipe cards,dvo enterprises inc. cookn cd recipe cards,matching
b000ndibhi,http://www.google.com/base/feeds/snippets/8042583218932085904,adobe creative suite cs3 web standard upsell [mac],adobe cs3 web standard upsell,matching
b00005rd70,http://www.google.com/base/feeds/snippets/17691332503246508957,train sim modeler design studio,abacus train sim modeler,matching
b0000cdvuh,http://www.google.com/base/feeds/snippets/17695920349455995837,learn to play keyboard (jewel case),alfred publishing inc learn to play keyboard,matching
b000rsk7k8,http://www.google.com/base/feeds/snippets/17663334954312320904,ufo afterlight,sos aggregation company ufo afterlight - topware interactive,matching
b0009x6qew,http://www.google.com/base/feeds/snippets/18305953820307083661,instant immersion italian deluxe v2.0 (large box),topics entertainment instant immersion italian deluxe 2.0 (mass merchant box),matching
b000tdgyks,http://www.google.com/base/feeds/snippets/17686732625070159576,enemy territory: quake wars,aspyr media inc enemy territory: quake wars,matching
b000pihtbk,http://www.google.com/base/feeds/snippets/18037480601440105621,weekly reader mastering elementary/middle school math learning,fogware publishing weekly reader ls mastering elementary & middle school math,matching
b000pihtbk,http://www.google.com/base/feeds/snippets/9522193715675586199,weekly reader mastering elementary/middle school math learning,weekly reader mastering elementary & middle school math (pc/mac) fogware,matching
b0002yiuns,http://www.google.com/base/feeds/snippets/17602054056835540213,sentinel: descendants in time,dreamcatcher interactive sentinel: descendants in time,matching
b000in8mj0,http://www.google.com/base/feeds/snippets/17707372056830171464,photostory on cd & dvd 5,magix entertainment corp. photostory on cd & dvd 5,matching
b000cs3s2c,http://www.google.com/base/feeds/snippets/17715266298340609214,flash remoting 1 alp ret eng cd 2u,adobe systems inc flash remoting 1.0 (net&java 2)(2 users),matching
b00005bigp,http://www.google.com/base/feeds/snippets/17738870551709614779,shapes,school zone interactive shapes on track software,matching
b000h1df7w,http://www.google.com/base/feeds/snippets/17737819843616715912,dragon naturally speaking standard v9,nuance communications inc. dragon ns standard v9,matching
b000p9cr66,http://www.google.com/base/feeds/snippets/17724977097925207764,mediarecover,allume systems inc mediarecover,matching
b000p9cr66,http://www.google.com/base/feeds/snippets/13212739364324191667,mediarecover,allume mediarecover,matching
b000j588g4,http://www.google.com/base/feeds/snippets/17733079574233143461,photo explosion 3.0,nova development corp photo explosion 3.0,matching
,,Adidas Duramo Sl Wide Lightmotion Running Shoes ,adidas Men Nitro - 11452 Running Shoe -,non
,,Adidas Runfalcon 3.0 Tr W ,"Shib Square Performance Runfalcon 3 Shoes, Black, 13",non
,,Adidas Advantage Shoes ,adidas Men Water&Beach Shoes P499,non
,,Gold Care White Shoes cleaner 75ml ,Kids Junior Trend Fusion Shoes Men Causal G3,non
,,Adidas Unisex Adilette Shower Slides ,Mintra unisex-adult slipper Slipper,non
,,Adidas Ultrabounce Running Shoes ,adidas Men Nitro - 11452 Running Shoe -,non
,,Adidas Ultraboost Light Running Shoes ,adidas Men Nitro - 11452 Running Shoe -,non
,,Adidas Runfalcon 3.0 W ,adidas Men Causal DS2,non
,,crocs Baya Blk-M4W6 ,Testa Toro TESTA Canvas Shoes Model-2460,non
,,Adidas Adilette Shower Slides ,adidas Men Water&Beach Shoes P499,non
,,crocs Bayaband Clog ,Now Shoes Men Causal DS1,non
,,crocs Crocband ,Now Shoes mock sneaker - Model 87/80,non
,,crocs Bayaband Clog ,Now Shoes Men Causal DS1,non
,,Adidas Breaknet Lifestyle Court Elastic Lace And Top Strap Shoes ,mens Casual Shoes Sneaker unisex-child Breaknet Lifestyle Court Elastic Lace and Top Strap Shoes TENNIS SHOES for Unisex Kids Sneakers,non
,,Adidas Runfalcon 3.0 W ,adidas Men Causal DS2,non
,,Adidas Unisex Adilette Clog Sandals ,adidas Unisex kids RUNFALCON 3.0 K Sneakers,non
,,Onda Uni Pamp cashmere Slide Slipper ,Onda unisex-adult Square Matelasse Slipper,non
,,Adidas Adilette Clogs ,adidas Men Causal DS2,non
,,Adidas Adilette Comfort Slides ,adidas Men Water&Beach Shoes P499,non
,,crocs Literide 360 Marble Clog ,Mintra Men Causal NO1,non
,,Generic Slip on sport shoes for unisex 2024 white ,Generic Casual Sneakers Shoes for men for Daily Life - D4,non
,,Adidas Adilette Aqua Slides ,adidas mens Casual Shoes Sneaker,non
,,Adidas Grand Court Minnie El K ,adidas Men Causal DS2,non
,,Adidas Duramo Sl Running Shoes ,adidas Men Nitro - 11452 Running Shoe -,non
,,Adidas Duramo Sl W Wide ,adidas Men Nitro - 11452 Running Shoe -,non
,,crocs Bayaband Clog ,Now Shoes Men Causal DS1,non
,,Adidas Ultra 4D Running Shoes ,adidas Men Nitro - 11452 Running Shoe -,non
,,Sitil Suede & Nubuck Renovator - extra white Color 75 ml ,Shib Square Mens Canvas Shoes For Men - Model 2460,non
,,Adidas X Crazyfast.4 Flexible Ground Football Boots ,adidas Slip On Socks With Light And Flexible Sole For Men,non
,,crocs Crocband DtAq M10W12 ,Now Shoes mock sneaker - Model 87/80,non
,,Adidas Questar 2 M ,adidas Men Causal DS2,non
,,crocs Crocband ,Now Shoes mock sneaker - Model 87/80,non
,,Adidas Copa Pure.4 Flexible Ground Football Boots ,adidas Slip On Socks With Light And Flexible Sole For Men,non
,,crocs Baya GrssGrn M9W11 ,adidas Basic Lace Up Shoes For Men,non
,,Adidas Avryn Running Shoes ,adidas Men Nitro - 11452 Running Shoe -,non
,,Onda Uni pamp slipper for  unisex ,Mintra unisex-adult slipper Slipper,non
,,Adidas Adilette Aqua Slides ,adidas mens Casual Shoes Sneaker,non
,,Adidas X Crazyfast Messi.4 Turf Football Boots ,adidas Men's Everyday Casual Microfiber Shoes,non
,,Adidas Copa Pure II Club Flexible Ground Football Boots ,adidas Slip On Socks With Light And Flexible Sole For Men,non
,,"Generic Beige Shoe and heel cushion insert pad foam shoe insoles, for loose shoes sore relief comfortable unisex universal fit ",Generic Running Shoes Men - Men Running Shoes - Shoes Mens Running - Men Sneakers Generic - Shoes Running Men - Men Shoes Sneakers - Men Shoes Sneakers,non
,,Onda Porto Double Buckle Slipper ,Onda unisex-adult Square Matelasse Slipper,non
,,Onda Fifa PM10 flip flop ,Onda unisex-adult Square Matelasse Slipper,non
,,Adidas Response Super 3.0 Running Shoes ,adidas Men Nitro - 11452 Running Shoe -,non
,,Adidas Pureboost 22 Boost Primeknit Kids Running Shoes ,adidas Men Nitro - 11452 Running Shoe -,non
,,Adidas Questar Running Shoes ,adidas Men Nitro - 11452 Running Shoe -,non
,,Adidas Adilette Shower Slides ,adidas Men Water&Beach Shoes P499,non
,,Adidas Top Sala Competition Indoor Football Boots ,adidas Slip On Socks With Light And Flexible Sole For Men,non
,,CUBS Safari Sandal ,Shib Square Men Causal k1,non
,,Adidas Copa Pure.4 Turf Football Boots ,adidas mens Casual Shoes Sneaker,non
,,Onda uni pamp Slide slipper ,Mintra unisex-adult slipper Slipper,non
,,"Generic Silicone/Fabric Heel Grips Liner Cushions Inserts for Loose Shoes, Heel Pads Snugs for Shoe Too Big Men Women, Filler Improved Shoe Fit and Comfort, Prevent Heel Slip and Bliste (Beige) ",Mintra Release 3/5/7/9cm Height Increase Insole Cushion Height Lift Adjustable Cut Shoe Heel Insert Taller Women Men Unisex Quality Foot Pads,non
,,Adidas Ultraboost Light Running Shoes ,adidas Men Nitro - 11452 Running Shoe -,non
,,Adidas Copa Pure II Club Flexible Ground Football Boots ,adidas Slip On Socks With Light And Flexible Sole For Men,non
,,Onda Uni Pamp Slide Slipper ,activ womens Slipper Slipper,non
,,Adidas Predator Accuracy.2 Firm Ground Football Boots ,adidas Men Fashion comfy sneakers from chamois leather,non
,,Adidas Ultraboost Light Running Shoes ,adidas Men Nitro - 11452 Running Shoe -,non
,,Adidas Avryn Running Shoes ,adidas Men Nitro - 11452 Running Shoe -,non
,,Onda Pronto Clog ,adidas Men Causal DS2,non
,,Adidas X_PLRPATH Running Shoes Kids ,adidas Men Nitro - 11452 Running Shoe -,non
,,Onda uni pamp Slide slipper ,Mintra unisex-adult slipper Slipper,non
,,Onda uni pamp Slide slipper ,Mintra unisex-adult slipper Slipper,non
,,Adidas Predator Accuracy.1 Turf Football Boots ,adidas Men's Everyday Casual Microfiber Shoes,non
,,Onda Uni Pamp Slide slipper ,activ womens Slipper Slipper,non
,,"Generic Black Shoe and heel cushion insert pad foam shoe insoles, for loose shoes sore relief comfortable unisex universal fit ",mens Casual Shoes Sneaker unisex-child Breaknet Lifestyle Court Elastic Lace and Top Strap Shoes TENNIS SHOES for Unisex Kids Sneakers,non
,,Adidas Duramo Sl Wide Lightmotion Running Shoes ,adidas Men Nitro - 11452 Running Shoe -,non
,,Adidas Runfalcon 3.0 Tr W ,"Shib Square Performance Runfalcon 3 Shoes, Black, 13",non
,,Adidas Advantage Shoes ,adidas Men Water&Beach Shoes P499,non
,,Gold Care White Shoes cleaner 75ml ,Kids Junior Trend Fusion Shoes Men Causal G3,non
,,Adidas Unisex Adilette Shower Slides ,Mintra unisex-adult slipper Slipper,non
,,Adidas Ultrabounce Running Shoes ,adidas Men Nitro - 11452 Running Shoe -,non
,,Adidas Ultraboost Light Running Shoes ,adidas Men Nitro - 11452 Running Shoe -,non
,,Adidas Runfalcon 3.0 W ,adidas Men Causal DS2,non
,,crocs Baya Blk-M4W6 ,Testa Toro TESTA Canvas Shoes Model-2460,non
,,Adidas Adilette Shower Slides ,adidas Men Water&Beach Shoes P499,non
,,crocs Bayaband Clog ,Now Shoes Men Causal DS1,non
,,crocs Crocband ,Now Shoes mock sneaker - Model 87/80,non
,,crocs Bayaband Clog ,Now Shoes Men Causal DS1,non
,,Adidas Breaknet Lifestyle Court Elastic Lace And Top Strap Shoes ,mens Casual Shoes Sneaker unisex-child Breaknet Lifestyle Court Elastic Lace and Top Strap Shoes TENNIS SHOES for Unisex Kids Sneakers,non
,,Adidas Runfalcon 3.0 W ,adidas Men Causal DS2,non
,,Adidas Unisex Adilette Clog Sandals ,adidas Unisex kids RUNFALCON 3.0 K Sneakers,non
,,Onda Uni Pamp cashmere Slide Slipper ,Onda unisex-adult Square Matelasse Slipper,non
,,Adidas Adilette Clogs ,adidas Men Causal DS2,non
,,Adidas Adilette Comfort Slides ,adidas Men Water&Beach Shoes P499,non
,,crocs Literide 360 Marble Clog ,Mintra Men Causal NO1,non
,,Generic Slip on sport shoes for unisex 2024 white ,Generic Casual Sneakers Shoes for men for Daily Life - D4,non
,,Adidas Adilette Aqua Slides ,adidas mens Casual Shoes Sneaker,non
,,Adidas Grand Court Minnie El K ,adidas Men Causal DS2,non
,,Adidas Duramo Sl Running Shoes ,adidas Men Nitro - 11452 Running Shoe -,non
,,Adidas Duramo Sl W Wide ,adidas Men Nitro - 11452 Running Shoe -,non
,,crocs Bayaband Clog ,Now Shoes Men Causal DS1,non
,,Adidas Ultra 4D Running Shoes ,adidas Men Nitro - 11452 Running Shoe -,non
,,Sitil Suede & Nubuck Renovator - extra white Color 75 ml ,Shib Square Mens Canvas Shoes For Men - Model 2460,non
,,Adidas X Crazyfast.4 Flexible Ground Football Boots ,adidas Slip On Socks With Light And Flexible Sole For Men,non
,,crocs Crocband DtAq M10W12 ,Now Shoes mock sneaker - Model 87/80,non
,,Adidas Questar 2 M ,adidas Men Causal DS2,non
,,crocs Crocband ,Now Shoes mock sneaker - Model 87/80,non
,,Adidas Copa Pure.4 Flexible Ground Football Boots ,adidas Slip On Socks With Light And Flexible Sole For Men,non
,,crocs Baya GrssGrn M9W11 ,adidas Basic Lace Up Shoes For Men,non
,,Adidas Avryn Running Shoes ,adidas Men Nitro - 11452 Running Shoe -,non
,,Onda Uni pamp slipper for  unisex ,Mintra unisex-adult slipper Slipper,non
,,Adidas Adilette Aqua Slides ,adidas mens Casual Shoes Sneaker,non
,,Adidas X Crazyfast Messi.4 Turf Football Boots ,adidas Men's Everyday Casual Microfiber Shoes,non
,,Adidas Copa Pure II Club Flexible Ground Football Boots ,adidas Slip On Socks With Light And Flexible Sole For Men,non
,,"Generic Beige Shoe and heel cushion insert pad foam shoe insoles, for loose shoes sore relief comfortable unisex universal fit ",Generic Running Shoes Men - Men Running Shoes - Shoes Mens Running - Men Sneakers Generic - Shoes Running Men - Men Shoes Sneakers - Men Shoes Sneakers,non
,,Onda Porto Double Buckle Slipper ,Onda unisex-adult Square Matelasse Slipper,non
,,Onda Fifa PM10 flip flop ,Onda unisex-adult Square Matelasse Slipper,non
,,Adidas Response Super 3.0 Running Shoes ,adidas Men Nitro - 11452 Running Shoe -,non
