idAmazon,idGoogleBase,title,Googlename,class
b000b6n2m6,http://www.google.com/base/feeds/snippets/12929795214910360357,mavis beacon teaches typing 17 standard,broderbund mavis beacon teaches typing standard17,matching
b000b6n2m6,http://www.google.com/base/feeds/snippets/9246547342017279002,mavis beacon teaches typing 17 standard,encore software 10075 - encore mavis beacon teaches typing v.17.0 standard - typing tutor - pc mac,matching
b000io799i,http://www.google.com/base/feeds/snippets/18226456193742595288,vault360 combo,bamboo technology llc vault360 combo,matching
b000ik414i,http://www.google.com/base/feeds/snippets/16073556725854260285,efrontier anime studio pro (win/mac),allume anime studio pro,matching
b000hlt5g2,http://www.google.com/base/feeds/snippets/3274305083856247424,monopoly here & now,encore software 11182 - monopoly here & now - win 98 me 2000 xp,matching
b0009suw4w,http://www.google.com/base/feeds/snippets/18425416409544307946,hoyle card games (jewel case),encore 10025 hoyle card games for pc,matching
b0009suw4w,http://www.google.com/base/feeds/snippets/4325793427900176296,hoyle card games (jewel case),encore software 10025 - hoyle card games (win 98 me 2000 xp),matching
b000mgo1r0,http://www.google.com/base/feeds/snippets/10555450463385817719,gorilla 4 pro,jungle software gorilla pro 4.0 film production,matching
b00007e8bi,http://www.google.com/base/feeds/snippets/18286585073343765950,oxford world encyclopedia,tri synergy inc oxford world encyclopedia,matching
b000ndibkk,http://www.google.com/base/feeds/snippets/4247841323668156699,adobe creative suite cs3 master collection upgrade [mac],adobe cs3 master collection upsell from cs2,matching
b0008g2bvm,http://www.google.com/base/feeds/snippets/18275035621919457369,obscure,dreamcatcher interactive obscure,matching
b000cp4ja0,http://www.google.com/base/feeds/snippets/3040037286169376262,network now! pro by encore,encore software 10393 - network now! pro by encore,matching
b0009yegpc,http://www.google.com/base/feeds/snippets/18259447335875519213,starry night galaxy explorer (pc & mac),orion/imaginova starry night galaxy explorer,matching
b0009yegpc,http://www.google.com/base/feeds/snippets/13834985344480832776,starry night galaxy explorer (pc & mac),starry night galaxy explorer (pc & mac) (snge-5-c1u),matching
b000hhxevi,http://www.google.com/base/feeds/snippets/2710470763365986624,hasbro classic collection ( 2006 ),encore software 11272 - hasbro: family collection (2006) - win 98 me 2000 xp,matching
b0007r7e7i,http://www.google.com/base/feeds/snippets/18118065911754783035,allegro 2005,emedia finale allegro,matching
b000bnjmnc,http://www.google.com/base/feeds/snippets/2723560865541859631,professor fuji's sudoku (jewel case),encore software 10313 - professor fujis sudoku (win 98 me 2000 xp),matching
b000o3ek2m,http://www.google.com/base/feeds/snippets/18295506345742178609,elementary advantage 2008,encore inc elementary advantage 2008,matching
b000230e4m,http://www.google.com/base/feeds/snippets/3000347833164648276,recam remote monitoring software,mobi-cam 70008 monitoring and notification software,matching
b000egidue,http://www.google.com/base/feeds/snippets/18264347410665748173,sudoku unlimited + crossword addict 2cd set,global software publ na sudoku,matching
b000iz8vqw,http://www.google.com/base/feeds/snippets/3000347833164648276,mobi recam camera monitoring and notification software,mobi-cam 70008 monitoring and notification software,matching
b000p4tc82,http://www.google.com/base/feeds/snippets/18172308291108986699,the little mermaid/beauty and the beast,phillip keveren disney's the little mermaid/beauty and the beast,matching
b000bypfu0,http://www.google.com/base/feeds/snippets/4573258796236774141,sharks 2.0,encore software 10279 - sharks 2.0 (win 95 98 me 2000 xp/mac 10.1 or higher),matching
b000ndib96,http://www.google.com/base/feeds/snippets/9426718267663314434,adobe illustrator cs3 upgrade [mac],adobe illustrator cs3 upgrade for mac,matching
b000h24200,http://www.google.com/base/feeds/snippets/4675262861576384624,hoyle casino (2007),encore software 10675 - hoyle casino 2007 - win 98 me 2000 xp,matching
b000q1pyv8,http://www.google.com/base/feeds/snippets/18171290245464117932,instant play guitar deluxe v2.,topics entertainment instant play guitar deluxe v2.0,matching
b000hpjgw6,http://www.google.com/base/feeds/snippets/4250686295132810758,pc hoyle jewels: swap & drop it,encore software 10662 - hoyle jewels: swap & drop - win 98 me 2000 xp,matching
b000mgo5bw,http://www.google.com/base/feeds/snippets/9250111493808447085,gorilla 4 student,jungle software gorilla student 4.0 film production,matching
b000ra77bs,http://www.google.com/base/feeds/snippets/4432724463066898018,jeopardy,encore software 14120 - jeopardy jc - win 98 me 2000 xp,matching
b000jh7c6y,http://www.google.com/base/feeds/snippets/18159360858957097495,your desktop post office for pc,stamps.com your desktop post office,matching
b000ndicze,http://www.google.com/base/feeds/snippets/17511510969143463932,adobe contribute cs3 [mac],adobe contribute cs3 upgrade,matching
b000ndicze,http://www.google.com/base/feeds/snippets/15315731988494931444,adobe contribute cs3 [mac],adobe contribute cs3,matching
b0002z8a1o,http://www.google.com/base/feeds/snippets/18163685181387991761,dance 6,digital leisure inc dance 6 (e-jay),matching
b000exw51k,http://www.google.com/base/feeds/snippets/18190434268931466210,registry mechanic 5.x pc system repair,encore inc registry mechanic,matching
b000exw51k,http://www.google.com/base/feeds/snippets/6804198758936861643,registry mechanic 5.x pc system repair,encore software 10598 - registry mechanic - win 98 me 2000 xp,matching
b000hi1i6u,http://www.google.com/base/feeds/snippets/3752772644614152917,axis & allies (jewel case),encore software 11620 - axis & allies - win 98 me 2000 xp,matching
b000jiqlxi,http://www.google.com/base/feeds/snippets/18151952927255406461,panda antivirus 2007,sos aggregation company panda antivirus 2007,matching
b000om7diq,http://www.google.com/base/feeds/snippets/17708766593513600591,corel dvd moviefactory 6.0 plus,corel corporation dvd movie factory 6 plus retial (english),matching
b000om7diq,http://www.google.com/base/feeds/snippets/5216140459207502478,corel dvd moviefactory 6.0 plus,corel ulead dvd moviefactory plus 6 software for windows authoring software,matching
b000om7diq,http://www.google.com/base/feeds/snippets/11294551601294188336,corel dvd moviefactory 6.0 plus,dvd moviefactory 6 plus,matching
b000o3bge2,http://www.google.com/base/feeds/snippets/3594701920411099396,defcon,encore software 13840 - defcon: global nuclear domination game - win 98 me 2000 xp vista,matching
b0009dxjuq,http://www.google.com/base/feeds/snippets/16790631679419428442,typing instructor deluxe (jewel case),individual software inc typing instructor deluxe j/c,matching
b000b63xha,http://www.google.com/base/feeds/snippets/14798220155665223365,bias peak pro 5 ( macintosh ),bias peak pro 5 software music production software,matching
b000nif4im,http://www.google.com/base/feeds/snippets/16793437722628106463,freestyle street basketball,vivendi-universal games inc freestyle street basketball,matching
b000in34bq,http://www.google.com/base/feeds/snippets/5571864419424285346,webroot spy sweeper with antivirus family edition - 3 pcs,webroot software inc 50410 - spy sweeper w/antivirus family edition (small box) - win 2000 xp,matching
b000v7rij8,http://www.google.com/base/feeds/snippets/16778737466501327415,my guitar,emedia music corp my guitar,matching
b000e2d3lc,http://www.google.com/base/feeds/snippets/16769449274864717899,rome total war gold edition,sega of america inc rome total war gold edition,matching
b000ffcdim,http://www.google.com/base/feeds/snippets/13298644336068097806,registry mechanic by encore software,encore software 10599 - encore registry mechanic v.5.1 - complete product - utility - 1 user(s) - complete product - standard - pc,matching
b000fzxipo,http://www.google.com/base/feeds/snippets/16630396354315555450,classification & ecology (win/mac) (jewel case),fogware publishing middle school life science - classification & ecology,matching
b000fzxipo,http://www.google.com/base/feeds/snippets/12453672105653412076,classification & ecology (win/mac) (jewel case),middle school life science - classification & ecology (pc/mac) fogware,matching
b000b57k4s,http://www.google.com/base/feeds/snippets/16798783463218493349,the print shop 21 deluxe by broderbund,encore software 10038 - encore the print shop v.21.0 deluxe - print management - pc,matching
b000hedyio,http://www.google.com/base/feeds/snippets/16622880533554607802,britannica deluxe,avanquest usa llc britannica deluxe,matching
b000pg7ha0,http://www.google.com/base/feeds/snippets/15026147703472509135,creating keepsakes scrapbook platinum v.3 sb cs by riverdeep,encore software 10610 - encore creating keepsakes scrapbook designer platinum - complete product - creativity application - 1 user - complete product - standard - pc,matching
b0000vmimw,http://www.google.com/base/feeds/snippets/18364436159487312703,leave the lights on (mac),aspyr leave the lights on-bundle,matching
b000ehs6h8,http://www.google.com/base/feeds/snippets/4818950838228892044,apple logic pro 7.2 upgrade,apple/emagic logic pro 7.2 software upgrade music production software,matching
b0007wv3ei,http://www.google.com/base/feeds/snippets/18347005743602331538,microspot macdraft professional (mac),microspot macdraft professional edition,matching
b000i4rmfe,http://www.google.com/base/feeds/snippets/14007006525589850325,nero 7 ultra edition enhanced,ahead software 70115 - nero 7 ultra edition enhanced mini pc & home entrmnt soln,matching
b000ar96bm,http://www.google.com/base/feeds/snippets/16873990150005697074,digital vault,migo software digital vault 2005,matching
b000e8rdrq,http://www.google.com/base/feeds/snippets/890958699191814692,audition 2 win ed ue 1u,adobe audition 2.0 audio production software - educational discount audio software for video,matching
b000b5srju,http://www.google.com/base/feeds/snippets/16872612252422367466,turbocad mac 3d for mac,imsi design llc turbocad mac 3d,matching
b000ehs6gy,http://www.google.com/base/feeds/snippets/14188088676549374410,apple logic pro 7.2 retail,apple/emagic logic pro 7.2 software music production software,matching
b000g80lku,http://www.google.com/base/feeds/snippets/16862951998092117648,peachtree by sage premium accounting 2007 - accountants' edition,sage (ptree) premium accounting accountants edition 2007,matching
b000pienlo,http://www.google.com/base/feeds/snippets/16974008974544976244,onone plug-in suite 3 for adobe photoshop,onone software plug-in suite - full,matching
b000pienlo,http://www.google.com/base/feeds/snippets/17138232112312322851,onone plug-in suite 3 for adobe photoshop,onone software pps-30211 - on1 plug-in suite v.3.0 for adobe photoshop - complete product - image collection/editing/archive - complete product - pc mac intel-based mac,matching
b000aqvrry,http://www.google.com/base/feeds/snippets/16846135635145492175,stompsoft digital file shredder pro,migo software digital file shredder 2005,matching
b000szzpi4,http://www.google.com/base/feeds/snippets/17036928989465404370,make music finale 2008 academic,make finale 2007 software - educational discount music production software,matching
b000ro5o7s,http://www.google.com/base/feeds/snippets/12991998923940483779,vegas movie studiodvd+8 plat,vegas movie studiodvd+8 plat,matching
b000ro5o7s,http://www.google.com/base/feeds/snippets/7129140322149464777,vegas movie studiodvd+8 plat,sony vegas movie studio+dvd v8 platinum edition video editing software professional editing software,matching
b000jlj0cy,http://www.google.com/base/feeds/snippets/16827217446944316033,gods & heroes: rome rising,sony online entertainment gods & heroes rome rising,matching
b00099xf0e,http://www.google.com/base/feeds/snippets/16819471998102486336,synet pc sharing kit(w/17ft usb ext.cable),synet electronics inc. synet pc sharing kit(w/17ft usb ext.cable),matching
b00005birs,http://www.google.com/base/feeds/snippets/16816523477506304009,math 2,school zone interactive math 2 on track software,matching
b000fn6cf4,http://www.google.com/base/feeds/snippets/8110280389757211340,pinnacle mobile media organizer,pinnacle mobile media organizer software for windows ipod software,matching
b0006ma3bs,http://www.google.com/base/feeds/snippets/16814254064816255791,gmp data rescue - license ( 24300 ),prosoft engineering data rescue universal license,matching
b0001gu7jc,http://www.google.com/base/feeds/snippets/17037106486883484113,mavis beacon teaches typing 16,mavis beacon 16,matching
b000k7vio0,http://www.google.com/base/feeds/snippets/9592753698712041843,intervideo windvd 8 gold,corel intervideo windvd 8 gold software for windows authoring software,matching
b0000899lt,http://www.google.com/base/feeds/snippets/16676630267570211401,talk now! learn afrikaans - beginning level,topics entertainment talk now! afrikaans - beginners,matching
b000brczzk,http://www.google.com/base/feeds/snippets/15013560737417394943,computrace lojack for laptops: 3 year subscription,absolute software lfl-n2-36 - computrace lojack for laptops - 3 year license (win 2000 xp),matching
b000ivjv10,http://www.google.com/base/feeds/snippets/16673725682059181917,instant immersion ingles audio deluxe,topics entertainment instant immersion ingles audio deluxe,matching
b0001d56uu,http://www.google.com/base/feeds/snippets/18039361276696190381,i copy dvd's 2,me too software 800001 - i copy dvds 2 (win 98 me 2000 xp),matching
b000brm3xe,http://www.google.com/base/feeds/snippets/18396085441922746096,computrace lojack for laptops: 1 year subscription,computrace lojack for laptops - 1 year license (win 2000 xp),matching
b000brm3xe,http://www.google.com/base/feeds/snippets/7181709960017015550,computrace lojack for laptops: 1 year subscription,absolute software lfl-n2-12 - computrace lojack for laptops - 1 year license (win 2000 xp),matching
b000rlqnr6,http://www.google.com/base/feeds/snippets/16687635820409313347,sony vegas movie studio + dvd 8 platinum edition,sony media software vegas movie studio + dvd 8 platinum edition,matching
b000gbukgm,http://www.google.com/base/feeds/snippets/11524039735478682676,computrace lojack for laptops - 1 year license (mac),computrace lojack for laptops - 1 yr subscription,matching
b000gbukgm,http://www.google.com/base/feeds/snippets/2448830856693653081,computrace lojack for laptops - 1 year license (mac),absolute software lfl-m2-12 - computrace lojack for laptops - 1 year license - mac 10.2 or higher,matching
b000nknb26,http://www.google.com/base/feeds/snippets/16685945982481680279,iaudioize - magnetic time for pc and mac,sos aggregation company iaudioize - magnetic time,matching
b000nknb26,http://www.google.com/base/feeds/snippets/18407763828897928168,iaudioize - magnetic time for pc and mac,iaudioize magnetic time for pc and mac,matching
b000jx1on0,http://www.google.com/base/feeds/snippets/16738828984601610049,safekeeper plus,bling software limited safekeeper plus,matching
b0002fgfiy,http://www.google.com/base/feeds/snippets/16668702350993735780,didi & ditto: kindergarten win/mac,kutoka interactive inc didi & ditto (kindergarten),matching
b000h0k3zu,http://www.google.com/base/feeds/snippets/12105115514315351902,logic express 7,apple logic express 7.2,matching
b000h0k3zu,http://www.google.com/base/feeds/snippets/2069408671914881522,logic express 7,apple/emagic logic express 7.2 software music production software,matching
b000trgqqg,http://www.google.com/base/feeds/snippets/16874485945364761422,travelogue 360: paris,aspyr media inc travelogue 360: paris,matching
b0007yepxc,http://www.google.com/base/feeds/snippets/16647647854444612501,instant immersion italian v2.0 (large box),topics entertainment instant immersion italian 2.0,matching
b000090179,http://www.google.com/base/feeds/snippets/17953929889613420408,power on now up to date & contact windows,now software nuw45e1k now up-to-date & contact for windows,matching
b000090179,http://www.google.com/base/feeds/snippets/4323218411575640054,power on now up to date & contact windows,now software nuw45e1k now up-to-date & contact for windows,matching
b000090179,http://www.google.com/base/feeds/snippets/16002979675138477406,power on now up to date & contact windows,now software nuw45e1k - now up-to-date & contact - complete product - content management - 1 user(s) - complete product - standard - pc,matching
b000090179,http://www.google.com/base/feeds/snippets/9700384320550908183,power on now up to date & contact windows,now software nuw45e1k now up-to-date & contact for windows,matching
b0009jhv5e,http://www.google.com/base/feeds/snippets/16721626632033099240,cook'n low fat,dvo enterprises inc. cookn low fat,matching
b000787g6q,http://www.google.com/base/feeds/snippets/14035761522429892531,serious magic visual communicator 2.0 web,serious magic visual communicator 2 web presentation software (windows) presentation software,matching
b00024wjrq,http://www.google.com/base/feeds/snippets/16744224390148606478,best of slots 2 (jewel case),masque publishing best of slots ii,matching
b000n28264,http://www.google.com/base/feeds/snippets/9029807166568270057,cubase 4 competitive crossgrade,steinberg cubase studio 4 software - competitive crossgrade music production software,matching
b000nkklwe,http://www.google.com/base/feeds/snippets/16700933768709687512,casual games pack,egames. inc casual games pack,matching
b00076ywj2,http://www.google.com/base/feeds/snippets/12002408855288739955,eovia carrara 4 pro win/mac,eovia carrara 4 pro software - mac/win animation software,matching
b000a40w4a,http://www.google.com/base/feeds/snippets/16720347622986234211,i spy fantasy v.2 with i spy book & mini cd,topics entertainment i spy fantasy w/ i spy bk & mini cd,matching
b000licg1m,http://www.google.com/base/feeds/snippets/6070036801370348429,power production storyboard artist 4,power production power production storyboard artist software animation software,matching
b000eg6d5q,http://www.google.com/base/feeds/snippets/16690738478999740250,instant immersion spanish audio deluxe,topics entertainment instant immersion spanish audio deluxe,matching
b0001xngz2,http://www.google.com/base/feeds/snippets/5836713568200382986,final draft 7 professional scriptwriting win/mac,final-draft final draft 7 screen writing software - mac/win screen writing software,matching
b000hbysf0,http://www.google.com/base/feeds/snippets/9117876336691363711,quickbooks customer manager 2.5,intuit quickbooks customer manager 2.5 for windows tax & finance software,matching
b000f7gysa,http://www.google.com/base/feeds/snippets/16702887737767240197,irispen express translator,iris inc irispen express translator,matching
b000fdetxq,http://www.google.com/base/feeds/snippets/4834494816656344498,apple remote desktop 3 unlim managed systems,apple remote desktop 3 unlimited managed systems,matching
b000fdetxq,http://www.google.com/base/feeds/snippets/1327096272598550732,apple remote desktop 3 unlim managed systems,apple remote desktop 3 - unlimited client edition - mac apple & mac software,matching
b000099107,http://www.google.com/base/feeds/snippets/16698946140878275557,time money & fractions grades 1-2,school zone interactive time money & fractions 1-2 on track software,matching
b000hjdpx8,http://www.google.com/base/feeds/snippets/1829125396804686622,mac os x server v10.4.7 unlimited client,apple mac os x server tiger - unlimited apple & mac software,matching
b000in6trc,http://www.google.com/base/feeds/snippets/6874875179525744781,spy sweeper w/antivirus family edition,webroot software inc 50210 - spy sweeper w/antivirus family edition (mass merchant) - win 2000 xp,matching
b000bu7u48,http://www.google.com/base/feeds/snippets/16694806128312036500,dance praise with dance pad (win/mac),sos aggregation company dance praise - digital praise,matching
b000fowht8,http://www.google.com/base/feeds/snippets/17133221075889749370,printmaster 17 platinum by encore software,encore software 10485 - encore printmaster v.17.0 platinum - complete product - creativity application - 1 user - complete product - standard - pc,matching
b000eqieik,http://www.google.com/base/feeds/snippets/8261805484012687318,genuine fractals genuine fractals print pro 1u,onone software genuine fractals print pro software,matching
b0001fyrq2,http://www.google.com/base/feeds/snippets/14693413290856659257,logic pro 6,apple software t9163ll/a logic pro 6,matching
b0009dt87e,http://www.google.com/base/feeds/snippets/12849123232978824729,professor teaches excel & word,individual software professor teaches excel & word,matching
b000b3z2zo,http://www.google.com/base/feeds/snippets/5286999908576362211,sibelius 4 educational edition,sibelius sibelius 4 software - educational discount music production software,matching
b000ra3l3g,http://www.google.com/base/feeds/snippets/6628446350064818078,terror strike,encore software 14060 - terror strike - win 2000 xp,matching
b0009nr9mu,http://www.google.com/base/feeds/snippets/16755727468265308879,wisdom of the bible - holy land edition,tri synergy inc wisdom of the bible - holy land edition,matching
b000t9luce,http://www.google.com/base/feeds/snippets/18388359068656820969,norton internet security 2008 10 user,norton internet security 2008 10 user,matching
b0002ip4lu,http://www.google.com/base/feeds/snippets/16739935323659993586,test and improve your memory (dvd box),tri synergy inc test & improve your memory - scientific brain training,matching
b000hjqyc2,http://www.google.com/base/feeds/snippets/15260761427784751076,roxio easy media creator 9,roxio easy media creator 9 suite software for windows authoring software,matching
b0001fyrqm,http://www.google.com/base/feeds/snippets/6239309275726276581,logic pro 6 upgrade from logic platinum/gold 5&6,apple software t9161ll/a logic platinum/ gold 5&6 to logic pro 6 update,matching
b00099e4ya,http://www.google.com/base/feeds/snippets/16750826951044664483,reel deal slots 2.0 for pc,phantom efx reel deal slots v 2.0,matching
b0000990y7,http://www.google.com/base/feeds/snippets/13833576505530604294,marine aquarium 2.0 (pc & mac),encore software 25005 - encore marine aquarium v.2.0 - complete product - screen saver - 1 user(s) - complete product - standard - pc mac,matching
b000o39u8q,http://www.google.com/base/feeds/snippets/5609692463569230619,elementary advantage 2008,encore software 12360 - elementary advantage 2008 - win 2000 xp vista,matching
b000o39u8q,http://www.google.com/base/feeds/snippets/12958721621590299185,elementary advantage 2008,elementary advantage 2008 encore,matching
b000nkfee4,http://www.google.com/base/feeds/snippets/10699505690150129858,finale songwriter 2007,make songwriter software music production software,matching
b000fk8b42,http://www.google.com/base/feeds/snippets/15528939772983751628,math success deluxe 2007,topics entertainment 80796 - topics math success 2007 deluxe for windows - educational software - pc,matching
b00099xdpq,http://www.google.com/base/feeds/snippets/9660795325358759539,language lab german,topics entertainment 40206 - instant immersion german lab (software/audiobook/workbook) - win 98 me 2000 xp/mac os 9 or x,matching
b000ra778g,http://www.google.com/base/feeds/snippets/1503028931039652298,wheel of fortune deluxe,encore software 14130 - wheel of fortune deluxe - win 98 me 2000 xp vista,matching
b000bdiqpc,http://www.google.com/base/feeds/snippets/17153123894129090968,neuratron photoscore professional 4,sibelius photoscore professional scanning software music production software,matching
b000fetuiy,http://www.google.com/base/feeds/snippets/10702491954940587385,elementary school advantage 2007,encore software 10443 - elementary school advantage 2007 - win 98 me 2000 xp,matching
b0009suw5q,http://www.google.com/base/feeds/snippets/712876185653102576,resumemaker professional 12.0,individual software resume maker professional deluxe 12.0,matching
b000in4uak,http://www.google.com/base/feeds/snippets/12243674671451624208,panda internet security 2007 3-user,panda software panda internet security 2007,matching
b0009yx9be,http://www.google.com/base/feeds/snippets/1021042895134770712,aquarium 3 in 1 collection - limited edition for win/mac,encore software 10123 - aquarium 3-in-one limited edition (eurpac) - win 95 98 me 2000 xp,matching
b00002s5ig,http://www.google.com/base/feeds/snippets/10121034673222484873,punch super home suite 3.0,punch software 17100 punch! super home suite,matching
b00002s5ig,http://www.google.com/base/feeds/snippets/8376577004489658408,punch super home suite 3.0,punch software 17100 punch! super home suite,matching
b00002s5ig,http://www.google.com/base/feeds/snippets/4015258116571466944,punch super home suite 3.0,punch software 17100 - punch! super home suite v.3.0 - complete product - architectural - 1 user - complete productcomplete productstandard - english - pc,matching
b00002s5ig,http://www.google.com/base/feeds/snippets/16696977577840370909,punch super home suite 3.0,punch software 17100 punch! super home suite,matching
b000gzy7oo,http://www.google.com/base/feeds/snippets/18207838499884290592,e-mu em8669 modern symphonic orchestra,e-mu modern symphonic orchestra for emulator x and proteus x sounds for software,matching
b0001xnkoy,http://www.google.com/base/feeds/snippets/17826820522977097999,final draft scriptwriter's suite [final draft 7 & final draft av2],final-draft scriptwriter's suite 2.5 screenwriting software - mac/win screen writing software,matching
b000ra20uq,http://www.google.com/base/feeds/snippets/594191839879876004,q*bert,encore software 14080 - q*bert - win 2000 xp vista,matching
b000h1de00,http://www.google.com/base/feeds/snippets/17326098494894452732,makemusic finale 2007 win/mac,make finale 2007 software music production software,matching
