original_product,best_match,similarity_score,noon_ref,noon_prices,amazon_ref,amazon_prices
docooler Portable Travel Jewelry Organizer Box ,Abhsant Abhsant Women's Velvet Layer 3 Lockable Portable Travel Jewelry Box (Green),0.5076923076923077,https://www.noon.com/egypt-en/portable-travel-jewelry-organizer-box/N33804472A/p/?o=ab5d77ee0d3896fe,149.85,https://www.amazon.eg/-/en/Abhsant-Womens-Lockable-Portable-Jewelry/dp/B09CNHY9GP,545
Generic Jewelry Box Organizer Large 3 Layers Velvet Jewelry Box Fannel Jewelry Organizer with Lock Jewelry Display Holder Case for Earring Necklace Makeup Watches(Green) ,"Generic Velvet Jewelry Trays Organizer, Stackable Jewelry Storage Display Trays for Drawer Earring Necklace Bracelet Ring Organizer, Set of 4",0.572347266881029,https://www.noon.com/egypt-en/jewelry-box-organizer-large-3-layers-velvet-jewelry-box-fannel-jewelry-organizer-with-lock-jewelry-display-holder-case-for-earring-necklace-makeup-watches-green/N52828323A/p/?o=e43e4b89b0e0bd6f,648,https://www.amazon.eg/-/en/Jewelry-Organizer-Stackable-Necklace-Bracelet/dp/B0BYCWY1R8,228
Generic Accessories Organizer For Organizing Rings Earrings And Chains Random Color Small Size ,"Generic Grey Jewelry Box, Accessories Travel Case, Necklace Earrings Rings Organizer, Nice Gift For Girls",0.47,https://www.noon.com/egypt-en/accessories-organizer-for-organizing-rings-earrings-and-chains-random-color-small-size/Z7AFE50CB823BB1CB8C1CZ/p/?o=z7afe50cb823bb1cb8c1cz-1,330,https://www.amazon.eg/-/en/Jewelry-Accessories-Necklace-Earrings-Organizer/dp/B0BYPZF8F3,145
Generic Set of 4 Stackable Jewelry Organizer Trays for Drawers Display Case Storage Container Earring Necklace Rings Bracelet with Removable Dividers ,"Generic ProCase Set of 4 Stackable Jewelry Organizer Trays for Drawers, Jewelry Drawer Inserts Container Display Case Storage for Earring Necklace Rings Bracelet with Removable Dividers -Grey",0.8387096774193549,https://www.noon.com/egypt-en/set-of-4-stackable-jewelry-organizer-trays-for-drawers-display-case-storage-container-earring-necklace-rings-bracelet-with-removable-dividers/Z32F5AFC7CBFDAB909A74Z/p/?o=z32f5afc7cbfdab909a74z-1,375,https://www.amazon.eg/-/en/Set-Stackable-Organizer-Container-Removable/dp/B09LVDQJZT,207
Julia Store 14K Gold Plated Flat Necklace ,"Generic Cleopatra 18k Gold Plated Egyption Cat -Handmade-Elegant Necklace,Best Gift For Her",0.48120300751879697,https://www.noon.com/egypt-en/14k-gold-plated-flat-necklace/Z619464933696046E4A14Z/p/?o=z619464933696046e4a14z-1,285,https://www.amazon.eg/-/en/Cleopatra-Plated-Egyption-Handmade-Elegant-Necklace/dp/B0CB1KHPWB,189
Generic 6 Drawers Acrylic Cosmetic and Jewelry Organizer ,Generic Accessory organizer,0.5476190476190477,https://www.noon.com/egypt-en/6-drawers-acrylic-cosmetic-and-jewelry-organizer/N16326781A/p/?o=b5da308bb51cd88c,245,https://www.amazon.eg/-/en/Generic-734077948315-Accessory-organizer/dp/B098P1YXNL,557
Generic Tree Shape Organizer And Holder For  Men  Jewelry And Accessories Black ,"Generic Star Shape Earrings for Women, Silver",0.48,https://www.noon.com/egypt-en/tree-shape-organizer-and-holder-for-men-jewelry-and-accessories-black/N49156323A/p/?o=e0f9d6b61f5ef70f,59.45,https://www.amazon.eg/-/en/Star-Shape-Earrings-Women-Silver/dp/B08ZXKZKCT,45
Generic Antlers Tree Designed Jewelry Display Stand ,Generic Accessory organizer,0.430379746835443,https://www.noon.com/egypt-en/antlers-tree-designed-jewelry-display-stand/N32533207A/p/?o=d934e547e0dd466e,66,https://www.amazon.eg/-/en/Generic-734077948315-Accessory-organizer/dp/B098P1YXNL,557
Generic Velvet Accessories And Jewelry Organizer ,Generic Accessory organizer,0.6842105263157895,https://www.noon.com/egypt-en/velvet-accessories-and-jewelry-organizer/ZFD640E86B0238740CB06Z/p/?o=zfd640e86b0238740cb06z-1,225,https://www.amazon.eg/-/en/Generic-734077948315-Accessory-organizer/dp/B098P1YXNL,557
Julia Store Wedding Jewelry Sets for Brides - Bridal Jewelry Set for Wedding Choker Necklace Earring Chain Bracelet Fashion Jewelry Set for Brides Bridesmaid Prom By Julia Store ,Gokeey Gold Bracelets for Women 14K Real Gold Jewelry Sets for Women Cuban Link Paperclip Chain Anklet Dainty Bracelets Jewelry Gifts for Women,0.5171339563862929,https://www.noon.com/egypt-en/wedding-jewelry-sets-for-brides-bridal-jewelry-set-for-wedding-choker-necklace-earring-chain-bracelet-fashion-jewelry-set-for-brides-bridesmaid-prom-by-julia-store/Z440392E4DFF1DB0C590EZ/p/?o=z440392e4dff1db0c590ez-1,650,https://www.amazon.eg/-/en/Gokeey-Bracelets-Jewelry-Paperclip-Anklet/dp/B0C98G8FRP,890
Generic Jewelry And Accessories Organizer Random color ,Generic Accessory organizer,0.6097560975609756,https://www.noon.com/egypt-en/jewelry-and-accessories-organizer-random-color/Z2C3CBDC2831584925A85Z/p/?o=z2c3cbdc2831584925a85z-1,225,https://www.amazon.eg/-/en/Generic-734077948315-Accessory-organizer/dp/B098P1YXNL,557
"Generic coobest Jewelry Box, 3 Drawer Jewelry Holder Organizer, Jewelry Boxes & Organizers with Earring Organizer, Jewelry Holder Box, Clear Jewelry Organizer Box for Jewelry Storage, Mothers Day Gifts ",FOMIYES FOMIYES 4pcs Candy Jewelry Box Jewelry Storage Organizer Boxes Jewelry Organizer Tray Bridal Shower Favors Jewelery Organizer Storage Case Storage Container,0.5628415300546448,https://www.noon.com/egypt-en/coobest-jewelry-box-3-drawer-jewelry-holder-organizer-jewelry-boxes-organizers-with-earring-organizer-jewelry-holder-box-clear-jewelry-organizer-box-for-jewelry-storage-mothers-day-gifts/ZCA26DA653E6A4614A3EEZ/p/?o=zca26da653e6a4614a3eez-1,520,https://www.amazon.eg/-/en/FOMIYES-Jewelry-Organizer-Jewelery-Container/dp/B0D9JQM5LX,405
3Diamonds Gold Plated Of Palestine Pendant Necklace - A Symbol Of Patriotism ,PAVOI 14K Gold Plated Cross Necklace for Women | Cross Pendant | Gold Necklaces for Women,0.4698795180722891,https://www.noon.com/egypt-en/gold-plated-of-palestine-pendant-necklace-a-symbol-of-patriotism/Z69964AE78B9B52E0E6F5Z/p/?o=z69964ae78b9b52e0e6f5z-1,200,https://www.amazon.eg/-/en/PAVOI-White-Plated-Faith-Necklace/dp/B07QV14NXW,134
"Our Generation Jewelry Doll, Julissa ",Generic Accessory organizer,0.40625,https://www.noon.com/egypt-en/jewelry-doll-julissa/ZA78829A5C68C3C6E6F46Z/p/?o=za78829a5c68c3c6e6f46z-1,"2,566",https://www.amazon.eg/-/en/Generic-734077948315-Accessory-organizer/dp/B098P1YXNL,557
Generic Butterfly Chain Necklace Cute Jewelry (assorted color) ,"Aetorgc Boho Necklaces Chain Beaded Necklace Jewelry for Women and Girls, Free Size,",0.5306122448979591,https://www.noon.com/egypt-en/butterfly-chain-necklace-cute-jewelry-assorted-color/Z499D236D3BBEB061BCA4Z/p/?o=z499d236d3bbeb061bca4z-1,70,https://www.amazon.eg/-/en/Aetorgc-Necklaces-Beaded-Necklace-Jewelry/dp/B08D76VGJ2,65
Generic Portable Small Storage Jewellery Box ,Generic Portable Travel Mini Jewelry Box Leather Jewellery Ring Organizer Case Storage Gift Box Girls Women (white).,0.484472049689441,https://www.noon.com/egypt-en/portable-small-storage-jewellery-box/N38912997A/p/?o=bc6e94e49efa0f4a,144,https://www.amazon.eg/-/en/Portable-Jewelry-Leather-Jewellery-Organizer/dp/B09MFLRNLG,130
Julia Store Gold Tone Chunky Hoop Earrings 14K Gold Plated Statement Thick Hollow Twist Tube Huggie Hoops Earrings Best Seller Hypoallergenic Fashion Jewelry Gifts By Julia Store ,"Generic 14K Gold Plated Stainless Steel Layered Bracelets Set for Women, 14K Gold Adjustable Dainty Paperclip Chain Link Bracelet Gold Filled Jewelry Gift By Julia Store",0.49425287356321834,https://www.noon.com/egypt-en/gold-tone-chunky-hoop-earrings-14k-gold-plated-statement-thick-hollow-twist-tube-huggie-hoops-earrings-best-seller-hypoallergenic-fashion-jewelry-gifts-by-julia-store/Z50E16ECEEFCC80904D6DZ/p/?o=z50e16eceefcc80904d6dz-1,265,https://www.amazon.eg/-/en/Stainless-Bracelets-Adjustable-Paperclip-Bracelet/dp/B0CMSBGJ9P,250
Shein 4pcs Women's Deluxe Square  Jewelry Set With Rhinestone Decoration ,Abhsant Abhsant Women's Velvet Layer 3 Lockable Portable Travel Jewelry Box (Green),0.4358974358974359,https://www.noon.com/egypt-en/4pcs-women-s-deluxe-square-jewelry-set-with-rhinestone-decoration/ZDD94F803BF8CC4C02472Z/p/?o=zdd94f803bf8cc4c02472z-1,349,https://www.amazon.eg/-/en/Abhsant-Womens-Lockable-Portable-Jewelry/dp/B09CNHY9GP,545
"Generic Sun and Moon Layered Necklaces  Dainty Choker Necklace Teen  Girlfriend Gifts Pedant Jewelry, metal, stainless-steel, ",Forevereally Layered Necklace Dainty Disc Chokers Necklace 14K Real Gold Plated Necklace for Women,0.5535714285714286,https://www.noon.com/egypt-en/sun-and-moon-layered-necklaces-dainty-choker-necklace-teen-girlfriend-gifts-pedant-jewelry-metal-stainless-steel/ZC2C5B8FE3C874FEF6013Z/p/?o=zc2c5b8fe3c874fef6013z-1,"1,200",https://www.amazon.eg/-/en/Forevereally-Plated-Layered-Necklace-stainless_steel/dp/B089NLJYZ2,597
DeFacto Woman Necklace - 3 Pack ,Other Necklace Mother Love Baby - Gold Plated,0.4155844155844156,https://www.noon.com/egypt-en/woman-necklace-3-pack/ZC4E363FE0AB72722A6C6Z/p/?o=zc4e363fe0ab72722a6c6z-1,249,https://www.amazon.eg/-/en/Necklace-Mother-Love-Baby-Plated/dp/B091CWN58K,239
"3Diamonds Elegant Gold-Plated Maple Leaf Pendant Necklace for Women - High-Quality Chain, Perfect Gift for Special Occasions, Fashionable Jewelry, Durable Design, Tarnish-Resistant ",Foxgirl Gold Heart Necklaces for Women 14k Gold Plated Pendant Necklace Simple Cute Necklaces for Women Dainty Layered Choker Necklaces for Women Gold Jewelry for Teen Girls,0.480225988700565,https://www.noon.com/egypt-en/elegant-gold-plated-maple-leaf-pendant-necklace-for-women-high-quality-chain-perfect-gift-for-special-occasions-fashionable-jewelry-durable-design-tarnish-resistant/Z8B45A9471B5C1E9DF31EZ/p/?o=z8b45a9471b5c1e9df31ez-1,180,https://www.amazon.eg/-/en/Foxgirl-Necklaces-Box-Necklace-Aesthetic/dp/B0BFDRT64F,217
Generic Women necklace of off white pearls & diamond lobes golden ,generic Isis necklace with Natural Zircon,0.5233644859813085,https://www.noon.com/egypt-en/women-necklace-of-off-white-pearls-diamond-lobes-golden/Z487EB85673A89435CD78Z/p/?o=z487eb85673a89435cd78z-1,255,https://www.amazon.eg/-/en/Isis-necklace-with-Natural-Zircon/dp/B0C7RNFXNP,314
"Generic Ultrasonic Jewelry Cleaner, 300ml Portable Ultrasonic Cleaner, Ultrasonic Cleaning Machine for All Jewelry Rings, Eyeglasses Watches, Dentures Necklace, Earrings Necklace ","Generic ZPROW Travel Jewelry Case, Mini Portable Jewelry Travel Boxes, Small Jewelry Organizer for Rings, Earrings, Pendants, Watches, Necklaces, Lipsticks Organizer Storage Holder Case (Pink)",0.5175202156334231,https://www.noon.com/egypt-en/ultrasonic-jewelry-cleaner-300ml-portable-ultrasonic-cleaner-ultrasonic-cleaning-machine-for-all-jewelry-rings-eyeglasses-watches-dentures-necklace-earrings-necklace/Z388EB8CFDEF14828BA13Z/p/?o=z388eb8cfdef14828ba13z-1,375,https://www.amazon.eg/-/en/Portable-Organizer-Earrings-Necklaces-Lipsticks/dp/B0BX8NQBJS,129
Shein 3pcs/set Circle Decor Jewelry Set GOLD ,Abhsant Abhsant Women's Velvet Layer 3 Lockable Portable Travel Jewelry Box (Green),0.40625,https://www.noon.com/egypt-en/3pcs-set-circle-decor-jewelry-set-gold/Z1596D4EBFDA135E04AA5Z/p/?o=z1596d4ebfda135e04aa5z-1,299,https://www.amazon.eg/-/en/Abhsant-Womens-Lockable-Portable-Jewelry/dp/B09CNHY9GP,545
Generic 4 Tier 360° Rotatable Jewelry Organizer Box white ,Generic Portable Travel Mini Jewelry Box Leather Jewellery Ring Organizer Case Storage Gift Box Girls Women (white).,0.5287356321839081,https://www.noon.com/egypt-en/4-tier-360-rotatable-jewelry-organizer-box-white/Z6A04E087D877DBEF27DCZ/p/?o=z6a04e087d877dbef27dcz-1,170,https://www.amazon.eg/-/en/Portable-Jewelry-Leather-Jewellery-Organizer/dp/B09MFLRNLG,130
"Generic 5700 pcs Clay Beads for Jewelry Making, 18 Colors 6mm Flat Beads for Bracelets Making, Trendy DIY Letter Small Round Beads Bracelet Making kit for Girls Women, Preppy Bracelet Bead kit ",Generic Yhluck 2pcs Carnelian Crystal Bracelet Handmade Natural Healing Gemstone Bracelet - stainless_steel,0.4733333333333334,https://www.noon.com/egypt-en/5700-pcs-clay-beads-for-jewelry-making-18-colors-6mm-flat-beads-for-bracelets-making-trendy-diy-letter-small-round-beads-bracelet-making-kit-for-girls-women-preppy-bracelet-bead-kit/Z97CE8A1C9573ABECDA26Z/p/?o=z97ce8a1c9573abecda26z-1,324,https://www.amazon.eg/-/en/Carnelian-Crystal-Bracelet-Handmade-Gemstone/dp/B09Z3WSDGR,102
Generic Elegant style Solid color Jewelry Golden ,Generic Women's Infinity Silver Bracelet,0.4943820224719101,https://www.noon.com/egypt-en/elegant-style-solid-color-jewelry-golden/ZECDAC18C2B37F9B04A15Z/p/?o=zecdac18c2b37f9b04a15z-1,188.85,https://www.amazon.eg/-/en/Generic-Womens-Infinity-Silver-Bracelet/dp/B08YNM6V5N,65
Julia Store 18K Gold Plated Stainless Steel Twisted Wire Bracelets Unisex Dainty Charm Bangle Bracelet Inspirational Adjustable Cuff Bracelet Jewelry Best Seller Birthday Gift By Julia Store ,"Generic 14K Gold Plated Stainless Steel Layered Bracelets Set for Women, 14K Gold Adjustable Dainty Paperclip Chain Link Bracelet Gold Filled Jewelry Gift By Julia Store",0.6,https://www.noon.com/egypt-en/18k-gold-plated-stainless-steel-twisted-wire-bracelets-unisex-dainty-charm-bangle-bracelet-inspirational-adjustable-cuff-bracelet-jewelry-best-seller-birthday-gift-by-julia-store/Z5A2656746FCD1D463B9EZ/p/?o=z5a2656746fcd1d463b9ez-1,295,https://www.amazon.eg/-/en/Stainless-Bracelets-Adjustable-Paperclip-Bracelet/dp/B0CMSBGJ9P,250
Generic Tree Shape Jewelry Organizer ,Generic Accessory organizer,0.625,https://www.noon.com/egypt-en/tree-shape-jewelry-organizer/N30721155A/p/?o=ba3324696a5498da,58.50,https://www.amazon.eg/-/en/Generic-734077948315-Accessory-organizer/dp/B098P1YXNL,557
Generic Multi-Functional Jewelry Box Organizer ,Generic Accessory organizer,0.5945945945945945,https://www.noon.com/egypt-en/multi-functional-jewelry-box-organizer/N36270957A/p/?o=e8ff26a2eacda99b,393.90,https://www.amazon.eg/-/en/Generic-734077948315-Accessory-organizer/dp/B098P1YXNL,557
3Diamonds Elegant Crescent Moon Pendant Necklace for Women - Premium Platinum-Plated Jewelry with Sparkling Crystals - Perfect Gift for He ,"Brexina Titanic Heart of the Ocean Necklace Women Girls Platinum Plated Cubic Zirconia Charm Necklace Jewelry Gift for Her, Cubic Zirconia, Cubic Zirconia",0.48464163822525597,https://www.noon.com/egypt-en/elegant-crescent-moon-pendant-necklace-for-women-premium-platinum-plated-jewelry-with-sparkling-crystals-perfect-gift-for-he/Z41A9FA45C01C691A99FBZ/p/?o=z41a9fa45c01c691a99fbz-1,240,https://www.amazon.eg/-/en/Brexina-Titanic-Necklace-Platinum-Zirconia/dp/B09HZWTJKB,134
Generic Mouse Jewelry Scales 200G 0.01G Portable Digital Scale Mouse Style Jewelry Scale Precision Scale Balance Pocket Gram Lcd Display ,"Generic Tasybox Velvet Jewelry Trays Organizer for Drawers, Small Stackable Jewelry Display Tray for Ring Earring Bangle Bracelet Necklace, Set of 4, Gray",0.48797250859106533,https://www.noon.com/egypt-en/mouse-jewelry-scales-200g-0-01g-portable-digital-scale-mouse-style-jewelry-scale-precision-scale-balance-pocket-gram-lcd-display/N50315318A/p/?o=f65d15195ba7cabd,239,https://www.amazon.eg/-/en/Tasybox-Organizer-Stackable-Bracelet-Necklace/dp/B094FJHBPV,210
The Jewellery Collection at the Musée des Arts Décoratifs ,fashion jewelery 6Pairs Set Earring Bohemia Style Gypsy - Sliver Plated,0.41860465116279066,https://www.noon.com/egypt-en/the-jewellery-collection-at-the-mus-e-des-arts-d-coratifs/Z5BC091FE74E0ED3E17D6Z/p/?o=z5bc091fe74e0ed3e17d6z-1,"1,900",https://www.amazon.eg/-/en/6Pairs-Earring-Bohemia-Style-Gypsy/dp/B091BT2CNQ,256
Generic Elegant style Solid color Color contrast Rhinestone Jewelry Variety pack ,Generic Vintage Style Necklace Gold Color Collar Style Fashion Necklaces For Women Jewelery Gift Necklace,0.5806451612903225,https://www.noon.com/egypt-en/elegant-style-solid-color-color-contrast-rhinestone-jewelry-variety-pack/Z9064AD5D93379665ED14Z/p/?o=z9064ad5d93379665ed14z-1,351.80,https://www.amazon.eg/-/en/Vintage-Necklace-Fashion-Necklaces-Jewelery/dp/B0DDR8313P,249
Generic Foldable Jewelry Storage Box Earrings Display Stand Bracelet Necklace Organizer ,"Generic Velvet Jewelry Trays Organizer, Stackable Jewelry Storage Display Trays for Drawer Earring Necklace Bracelet Ring Organizer, Set of 4",0.5502183406113537,https://www.noon.com/egypt-en/foldable-jewelry-storage-box-earrings-display-stand-bracelet-necklace-organizer/N52012821A/p/?o=d2915293cae082ec,295,https://www.amazon.eg/-/en/Jewelry-Organizer-Stackable-Necklace-Bracelet/dp/B0BYCWY1R8,228
Generic YANCHUN Layered Necklaces  Dainty Charm Stacked Necklace Gold/Silver Beaded Bar Cion Chains Trendy Layering Chokers Statement Boho Beach Jewelry Gold Necklace Stack ,Generic Vintage Style Necklace Gold Color Collar Style Fashion Necklaces For Women Jewelery Gift Necklace,0.5035971223021583,https://www.noon.com/egypt-en/yanchun-layered-necklaces-dainty-charm-stacked-necklace-gold-silver-beaded-bar-cion-chains-trendy-layering-chokers-statement-boho-beach-jewelry-gold-necklace-stack/Z2BAF944A4C770707AB04Z/p/?o=z2baf944a4c770707ab04z-1,314,https://www.amazon.eg/-/en/Vintage-Necklace-Fashion-Necklaces-Jewelery/dp/B0DDR8313P,249
Julia Store 18K Gold Plated Stainless Steel Highly Polished Delicate Deluxe Elegant Bead Ball Drop Dangle Earrings Jewelry Gift Women Girls By Julia Store ,Generic 18k Gold Plated Tennis Stainless Steel Oval Love Friendship Cuff Bangles Bracelets Set For Women Girl Gifts For Women Girls By Julia Store,0.5913621262458472,https://www.noon.com/egypt-en/18k-gold-plated-stainless-steel-highly-polished-delicate-deluxe-elegant-bead-ball-drop-dangle-earrings-jewelry-gift-women-girls-by-julia-store/Z661D5B1DD3711D471055Z/p/?o=z661d5b1dd3711d471055z-1,150,https://www.amazon.eg/-/en/Plated-Stainless-Friendship-Bangles-Bracelets/dp/B0CJHQYHGR,300
Generic A collection of several different styles of beads for making jewelry. ,Other 18 k gold plated chain pendant necklace amethyst heart purple color stone for women girl jewelery,0.47513812154696133,https://www.noon.com/egypt-en/a-collection-of-several-different-styles-of-beads-for-making-jewelry/Z71FF6D360C6EA033FDDAZ/p/?o=z71ff6d360c6ea033fddaz-1,799.20,https://www.amazon.eg/-/en/plated-pendant-necklace-amethyst-jewelery/dp/B098TVN8G9,490
Generic Lightweight Durable Jewellery Organizer ,Generic Accessory organizer,0.5333333333333333,https://www.noon.com/egypt-en/lightweight-durable-jewellery-organizer/N23708336A/p/?o=a13e546d4aa9b9cb,75,https://www.amazon.eg/-/en/Generic-734077948315-Accessory-organizer/dp/B098P1YXNL,557
DeFacto Woman Necklace ,Generic Women's Infinity Silver Bracelet,0.38095238095238093,https://www.noon.com/egypt-en/woman-necklace/Z7A393566DF0DAAAA5686Z/p/?o=z7a393566df0daaaa5686z-1,209,https://www.amazon.eg/-/en/Generic-Womens-Infinity-Silver-Bracelet/dp/B08YNM6V5N,65
Generic Solid color Irregular Jewelry Golden ,Generic Accessory organizer,0.4722222222222222,https://www.noon.com/egypt-en/solid-color-irregular-jewelry-golden/Z04C6D35A128D72CB3EF2Z/p/?o=z04c6d35a128d72cb3ef2z-1,146.75,https://www.amazon.eg/-/en/Generic-734077948315-Accessory-organizer/dp/B098P1YXNL,557
Generic Personalized Jewelry Custom Initial Pendant Custom Name Necklaces ,"Generic Cleopatra 18k Gold Plated Egyption Cat -Handmade-Elegant Necklace,Best Gift For Her",0.4606060606060606,https://www.noon.com/egypt-en/personalized-jewelry-custom-initial-pendant-custom-name-necklaces/Z105247CFAD0C8AE9E2B3Z/p/?o=z105247cfad0c8ae9e2b3z-1,695,https://www.amazon.eg/-/en/Cleopatra-Plated-Egyption-Handmade-Elegant-Necklace/dp/B0CB1KHPWB,189
"Generic Jewelry and makeup bag/ A multi-layer bag for organizing jewelry, accessories and makeup, consisting of 3 layers with a lock and made of high-quality materials. ","Generic ProCase Set of 4 Stackable Jewelry Organizer Trays for Drawers, Jewelry Drawer Inserts Container Display Case Storage for Earring Necklace Rings Bracelet with Removable Dividers -Grey",0.4444444444444444,https://www.noon.com/egypt-en/jewelry-and-makeup-bag-a-multi-layer-bag-for-organizing-jewelry-accessories-and-makeup-consisting-of-3-layers-with-a-lock-and-made-of-high-quality-materials/Z1B83B500FD23A0D6F97CZ/p/?o=z1b83b500fd23a0d6f97cz-1,629,https://www.amazon.eg/-/en/Set-Stackable-Organizer-Container-Removable/dp/B09LVDQJZT,207
3Diamonds Elegant Platinum-Plated Allah Pendant Necklace with Crystals - 3 Diamond Collection - Women's Islamic Jewelry ,Other 18 k gold plated chain pendant necklace amethyst heart purple color stone for women girl jewelery,0.49327354260089684,https://www.noon.com/egypt-en/elegant-platinum-plated-allah-pendant-necklace-with-crystals-3-diamond-collection-women-s-islamic-jewelry/ZE7608E7DBF54E450A441Z/p/?o=ze7608e7dbf54e450a441z-1,270,https://www.amazon.eg/-/en/plated-pendant-necklace-amethyst-jewelery/dp/B098TVN8G9,490
Julia Store Italian Mesh Link Chain Necklace ,NYC Sterling Women's Magnificent 3mm Round Cubic Zirconia Tennis Necklace,0.44067796610169496,https://www.noon.com/egypt-en/italian-mesh-link-chain-necklace/Z2114F1DB7153AC473DD8Z/p/?o=z2114f1db7153ac473dd8z-1,290,https://www.amazon.eg/-/en/NYC-Sterling-Magnificent-Zirconia-Necklace/dp/B07J5VMFTN,267
"3Diamonds Elegant Gold Plated Wing Pendant Necklace – High-Quality Jewelry with Intricate Design, Perfect for a Graceful and Stylish Look – Durable and Unique, Ideal Gift for Women ",DEARMAY Gold Bracelets for Women 14K Real Gold Plated Jewelry Sets Stack Trendy Dainty Stackable Paperclip Rope Snake Box Figaro Chain Bracelets Pack Costume Fashion Filled Gifts for Womens,0.4540540540540541,https://www.noon.com/egypt-en/elegant-gold-plated-wing-pendant-necklace-high-quality-jewelry-with-intricate-design-perfect-for-a-graceful-and-stylish-look-durable-and-unique-ideal-gift-for-women/Z7921C309188EA3433302Z/p/?o=z7921c309188ea3433302z-1,250,https://www.amazon.eg/-/en/DEARMAY-Bracelets-Jewelry-Stackable-Paperclip/dp/B0C2P72WY6,724
Mountain Gems Mega Set Craft Jamiaca Kit with Organizer Box and extra box of Gemstone and Crystals for DIY Bracelets Jewelry Making ,Generic Amazin Beaded Semi-Precious Gemstones for Women Girls Stone Stretch Elastic Bracelets Jewelery Gifts,0.4666666666666667,https://www.noon.com/egypt-en/mega-set-craft-jamiaca-kit-with-organizer-box-and-extra-box-of-gemstone-and-crystals-for-diy-bracelets-jewelry-making/Z14573B12F967B540BC40Z/p/?o=z14573b12f967b540bc40z-1,"1,033",https://www.amazon.eg/-/en/Semi-Precious-Gemstones-Bracelets-Jewelery-Chestnut/dp/B0CKJNZQQ4,149
Generic 6 Drawers Acrylic Cosmetic and Jewelry Organizer ,Generic Accessory organizer,0.5476190476190477,https://www.noon.com/egypt-en/6-drawers-acrylic-cosmetic-and-jewelry-organizer/N16326781A/p/?o=b5da308bb51cd88c,245,https://www.amazon.eg/-/en/Generic-734077948315-Accessory-organizer/dp/B098P1YXNL,557
Generic Tree Shape Jewelry Organizer ,Generic Accessory organizer,0.625,https://www.noon.com/egypt-en/tree-shape-jewelry-organizer/N30721155A/p/?o=ba3324696a5498da,58.50,https://www.amazon.eg/-/en/Generic-734077948315-Accessory-organizer/dp/B098P1YXNL,557
OPI Display Stand Deer Tree Holder Bracelet Earrings 24 x 22 Centimeter ,"Generic Star Shape Earrings for Women, Silver",0.4273504273504274,https://www.noon.com/egypt-en/display-stand-deer-tree-holder-bracelet-earrings-24-x-22-centimeter/N24283512A/p/?o=e7a38fb24b83e0ac,75,https://www.amazon.eg/-/en/Star-Shape-Earrings-Women-Silver/dp/B08ZXKZKCT,45
Generic Accessories Organization Acrylic 4 Circles Rounded ,Generic Accessory organizer,0.5581395348837209,https://www.noon.com/egypt-en/accessories-organization-acrylic-4-circles-rounded/N49258887A/p/?o=dd0885baab62c89d,83.50,https://www.amazon.eg/-/en/Generic-734077948315-Accessory-organizer/dp/B098P1YXNL,557
Generic Jewelry And Accessories Organizer Random color ,Generic Accessory organizer,0.6097560975609756,https://www.noon.com/egypt-en/jewelry-and-accessories-organizer-random-color/Z2C3CBDC2831584925A85Z/p/?o=z2c3cbdc2831584925a85z-1,225,https://www.amazon.eg/-/en/Generic-734077948315-Accessory-organizer/dp/B098P1YXNL,557
Generic Large 24 Grids Plastic Organizer Box Adjustable Dividers Clear Storage Box for Jewelry Art Crafts Washi Tapes Beads and Small Parts ,"Generic Velvet Jewelry Trays Organizer, Stackable Jewelry Storage Display Trays for Drawer Earring Necklace Bracelet Ring Organizer, Set of 4",0.48398576512455516,https://www.noon.com/egypt-en/large-24-grids-plastic-organizer-box-adjustable-dividers-clear-storage-box-for-jewelry-art-crafts-washi-tapes-beads-and-small-parts/Z52D0001613DBC8D39278Z/p/?o=z52d0001613dbc8d39278z-1,82.70,https://www.amazon.eg/-/en/Jewelry-Organizer-Stackable-Necklace-Bracelet/dp/B0BYCWY1R8,228
Generic Antlers Tree Designed Jewelry Display Stand ,Generic Accessory organizer,0.430379746835443,https://www.noon.com/egypt-en/antlers-tree-designed-jewelry-display-stand/N32533207A/p/?o=d934e547e0dd466e,66,https://www.amazon.eg/-/en/Generic-734077948315-Accessory-organizer/dp/B098P1YXNL,557
Fashion Jewelry Couples Bracelet Kit magnet ,Fashion Jewelery Glasses Holder for men & women - brown,0.5656565656565656,https://www.noon.com/egypt-en/couples-bracelet-kit-magnet/Z93A0C9666489C05D8ECAZ/p/?o=z93a0c9666489c05d8ecaz-1,75,https://www.amazon.eg/-/en/Fashion-Jewelery-Glasses-Holder-Brown/dp/B091J5BLGW,75
QiaoKai Antler Tree Design Jewellery Shelf ,"itianxi Dainty Cross Charm Pendant Necklaces,14K Gold Tiny Three Ball Necklace,Simple Fashion Jewelry for Women",0.38961038961038963,https://www.noon.com/egypt-en/antler-tree-design-jewellery-shelf/N15252628A/p/?o=e1a495df4b1f73bd,75,https://www.amazon.eg/-/en/itianxi-Dainty-Cross-Pendant-Necklaces/dp/B0811NH33V,76
Generic Black accessories and jewelry organizer ,Generic Accessory organizer,0.6933333333333334,https://www.noon.com/egypt-en/black-accessories-and-jewelry-organizer/ZBF7547F865C31A1387AAZ/p/?o=zbf7547f865c31a1387aaz-1,225,https://www.amazon.eg/-/en/Generic-734077948315-Accessory-organizer/dp/B098P1YXNL,557
